{
  "$schema": "https://json-schema.org/draft/2020-12/schema",
  "$id": "context-boundary-record.schema.json",
  "title": "Context Boundary Record",
  "description": "Technical governance metadata for a bounded context. It does not declare legal ownership, transfer authority, or authorize use.",
  "type": "object",
  "additionalProperties": false,
  "properties": {
    "schema_version": {
      "type": "string",
      "const": "1.0.0",
      "minLength": 1
    },
    "context_id": {
      "type": "string",
      "minLength": 1
    },
    "owner_ref": {
      "type": "string",
      "minLength": 1
    },
    "purpose": {
      "type": "string",
      "minLength": 1
    },
    "decision_scope": {
      "type": "string",
      "minLength": 1
    },
    "source_refs": {
      "type": "array",
      "minItems": 1,
      "items": {
        "type": "string",
        "minLength": 1
      }
    },
    "authorized_users": {
      "type": "array",
      "items": {
        "type": "string",
        "minLength": 1
      }
    },
    "authorized_agents": {
      "type": "array",
      "items": {
        "type": "string",
        "minLength": 1
      }
    },
    "permitted_uses": {
      "type": "array",
      "minItems": 1,
      "items": {
        "type": "string",
        "minLength": 1
      }
    },
    "prohibited_uses": {
      "type": "array",
      "minItems": 1,
      "items": {
        "type": "string",
        "minLength": 1
      }
    },
    "sensitivity": {
      "type": "string",
      "minLength": 1
    },
    "retention": {
      "type": "string",
      "minLength": 1
    },
    "exportability": {
      "type": "string",
      "enum": [
        "NONE",
        "RESTRICTED",
        "PERMITTED"
      ],
      "minLength": 1
    },
    "derivative_handling": {
      "type": "string",
      "minLength": 1
    },
    "freshness": {
      "type": "string",
      "minLength": 1
    },
    "expires_at": {
      "type": "string",
      "pattern": "^\\d{4}-\\d{2}-\\d{2}T\\d{2}:\\d{2}:\\d{2}Z$"
    },
    "evidence_refs": {
      "type": "array",
      "minItems": 1,
      "items": {
        "type": "string",
        "minLength": 1
      }
    },
    "reference_only": {
      "type": "boolean",
      "const": true
    },
    "authority_effect": {
      "type": "string",
      "const": "NONE",
      "minLength": 1
    }
  },
  "required": [
    "schema_version",
    "context_id",
    "owner_ref",
    "purpose",
    "decision_scope",
    "source_refs",
    "authorized_users",
    "authorized_agents",
    "permitted_uses",
    "prohibited_uses",
    "sensitivity",
    "retention",
    "exportability",
    "derivative_handling",
    "freshness",
    "expires_at",
    "evidence_refs",
    "reference_only",
    "authority_effect"
  ]
}
